post_id	text	date
42	Наши инвестиции работают  ЗДЕСЬ: http://vk.cc/4JBeoL, а СТРОИМ мы ЭТО:  http://www.youtube.com/watch?v=l_fVsRxputM	2016-02-03 13:13:37
43	МЫ - ДЕТИ И ВНУЦЫ БОГОВ! http://vk.cc/4JynbP	2016-02-03 10:07:31
44	Многие акционеры спрашивают, откуда такая высокая прибыль и почему сегодня мы можем покупать акции по такой цене, а после постройки Экотехнопарка цена одной акции будет от 1 доллара. Так вот: транспорт - это огромнейшая индустрия и  развитие дорог СКАЙВЭЙ будет формировать новые сферы бизнеса, с которых мы как акционеры будем получать  доход. Короткие видео по некоторым из них, подборка одного из партнёров::  ВОДА И ЛЕД : https://www.youtube.com/watch?v=UeJ4LMgYqOo   ДОБЫЧА РЕДКОЗЕМЕЛЬНЫХ МЕТАЛЛОВ: https://www.youtube.com/watch?v=2GTIPKAKAhI    ДОБЫЧА ЖЕЛЕЗНОЙ РУДЫ: https://www.youtube.com/watch?v=G9D16aAEgyg   ТУРИЗМ И ОТДЫХ НА ПРИРОДЕ: https://www.youtube.com/watch?v=9HtvWmAIHDs   ВАКУУМНОЕ СТЕКЛО ДЛЯ СКАЙХАУЗОВ И ТЕПЛИЦ: https://www.youtube.com/watch?v=CGxLdRnp6P0   СТРУННОЕ ОГРАЖДЕНИЕ: https://www.youtube.com/watch?v=WCs6NMnW4ik  , https://www.youtube.com/watch?v=uG2voCGMahM	2016-02-02 10:29:39
45	НОВОСТЬ ОБОДРЯЮЩАЯ. Руководством проекта НЕБЕСНЫЕ ДОРОГИ принято решение о продлении СПЕЦДИСКОНТА на весь февраль. Это означает, что СОХРАНИЛАСЬ ВОЗМОЖНОСТЬ стать совладельцем САМОГО КРУПНОГО БИЗНЕСА В ИСТОРИИ ЦИВИЛИЗАЦИИ на уникальных условиях. Ваши активы за несколько месяцев могут вырасти в СОТНИ РАЗ. ТАКОЕ ПРЕДЛОЖЕНИЕ БЫВАЕТ РАЗ В ЖИЗНИ.	2016-02-01 23:04:38
46	Описание проекта внушает доверие. ИСПЫТАЕМ! По результатам отчитаемся на странице.	2016-02-01 09:52:37
47	Вчера у меня состоялся интересный диалог в личке ВК с организатором одного ИНФОРМАЦИОННО-ИНВЕСТИЦИОННОГО ПОРТАЛА. Привожу с минимальными изменениями, сохраняя смысл. «- (Имя), ВЕНЧУРНЫЕ проекты входят в спектр ваших интересов? - Да, но не Юницкий. Другими словами меня больше интересует краудфандинг и краудинвестинг. Это новое направление, что-то вроде венчурных фондов только организовано хаотичным фан или инвест сообществом.  - Чем Юницкий НЕ краудинвестинг? - Тем что за своими услугами мог прибегнуть к краудинвестинговым платформам а пошел почему то по другому пути. Но проще говоря не тема для дискусси я сделал свой выбор - То есть, НЕ воспользовался СУЩЕСТВУЮЩИМИ платформами, а создал СВОЮ?  Благо дарю за общение. Я тоже сделал свой выбор.» Мой комментарий. Я стараюсь уважать ЛЮБОЕ мнение ЛЮБОГО человека, как и само ПРАВО иметь таковое; но имею своё. Итак, нас рассудит ВРЕМЯ. Вернёмся к этому разговору в ноябре 2016.  ЖДАТЬ ОСТАЛОСЬ НЕДОЛГО!	2016-01-31 08:37:08
48	Сегодня ПОСЛЕДНИЙ ДЕНЬ, когда ещё можно стать СОВЛАДЕЛЬЦЕМ транспорта будущего на уникальных условиях: минимальная инвестиция в $25 за 9-10 месяцев вполне может дать рост активов в 200 раз! (не путать с 200%). увеличение суммы инвестиции даёт ЕЩЁ бОльшую кратность роста. Регистрация http://vk.cc/45QotN  НИ К ЧЕМУ НЕ ОБЯЗЫВАЕТ, лишь даёт ОГРОМНЫЕ ВОЗМОЖНОСТИ	2016-01-31 08:11:00
49	Отвечаю на множество ехидных вопросов  в переписке:  в компании СКАЙВЭЙИНВЕСТГРУПП  можно иметь значительный доход  как  успешно выстраивая партнёрскую сеть  И НЕ ИМЕЯ НИ РУБЛЯ ДЕНЕГ, так и  ИНВЕСТИРУЯ СОБСТВЕННЫЕ СРЕДСТВА БЕЗ ЕДИНОГО ПРИГЛАШЕНИЯ. Места хватит всем. При совмещении результат умножается многократно. Подробности в личке, скавйпе.	2016-01-29 13:31:00
50	ЕЩЁ РАЗ УТОЧНЮ: Регистрация http://vk.cc/45QotN  НИ К ЧЕМУ НЕ ОБЯЗЫВАЕТ, лишь даёт ОГРОМНЫЕ ВОЗМОЖНОСТИ. Здесь рассказать обо всём невозможно. Правильнее изучать в личном кабинете.	2016-01-29 09:03:54
51	НОВЫЙ ВИТОК В РАЗВИТИИ  НЕБЕСНЫЕ ДОРОГИ СТРЕМИТЕЛЬНО ВЫХОДЯТ ИЗ ЗОНЫ РИСКА. СМОТРИТЕ, И НЕ ГОВОРИТЕ ПОТОМ, ЧТО НЕ ВИДЕЛИ!!! Особенно с 55-й минуты. http://www.youtube.com/watch?v=TFkimFW2Mqg	2016-01-28 23:59:21
52	Итак, друзья, осталось всего ТРИ ДНЯ до окончания действия уникального предложения, КОТОРОЕ БЫВАЕТ РАЗ В ЖИЗНИ. И не только в Вашей. Такого не могло быть у Ваших предков и вряд ли будет у потомков.  КТО НАМЕРЕН КОРОТКО И ЯСНО УЗНАТЬ ОБ ЭТОМ ПРЕДЛОЖЕНИИ, СРОЧНО стучитесь в скайп.	2016-01-28 23:50:23
53	ЗАМРИТЕ, АНГЕЛЫ, СМОТРИТЕ - Я ИГРАЮ,,, Двое гениальных людей одного поколения, достигшие вершин творчества - каждый в своём деле:  Красота и точность в танце - Карлос  ГАВИТО http://vk.cc/4HycGr  ...и в инженерии - Анатолий ЮНИЦКИЙ http://www.youtube.com/watch?v=n73CRPddDW8	2016-01-27 10:43:30
54	ЮНОЕ ПОКОЛЕНИЕ - ЗА!!! https://www.youtube.com/watch?v=3SWwZd60wps	2016-01-26 12:22:00
55	"Друзья мои!  Прежде, чем предлагать ""САМЫЙСАМЫЙНОВЫЙКРУТОЙМЕГАПРОЕКТБОМБАДЕНЬГИСРАЗУИМНОГОУСПЕЙБЫТЬПЕРВЫМ!!!"",  - прогуляйтесь лёгкой походкой по страничке. Желательно иметь с собой ГОЛОВУ."	2016-01-26 11:10:57
56	Проект СКАЙВЭЙ –  НЕ ДЛЯ ТЕХ, кто желает «срубить бабла много и быстро»,  поэтому я не призываю быть в числе первых. Здесь выигрывают ВСЕ, выигрывают НЕ БЫСТРО, но по-крупному.  Моё приглашение в прорывной венчурный технологический проект БЕССРОЧНО, потому что величие не терпит суеты. Нам не нужны случайные попутчики, предпочитаем иметь дело с основательными людьми. Верить мне не обязательно. Убеждайтесь во всём САМИ, хотите – съездите на место, потрогайте руками,  НО только когда будете  УВЕРЕНЫ в своём решении – ДОБРО ПОЖАЛОВАТЬ  в команду.  P.S. Те, кто увидит в  этом лохотрон, разводилово и прочее – друзья, идите своим путём! Я за полтора года таких наслушался.   РАЗРЕШАЮ  вам вернуться к теме в любое удобное время. Упущенное будете оценивать сами. Регистрация в проекте: http://vk.cc/45QotN	2016-01-26 11:00:39
57	Друзья, улыбнитесь перед началом трудовой недели! И пусть этот  позитивчик напоминает вам основную тему моей странички! Ведь эта песенка в том числе о Юницком и о нас всех!	2016-01-24 18:15:12
