post_id	text	date
1	Друзья мои, подписчики и гости!  Прежде, чем предлагать СУПЕРГРАНДИОЗНЫЕ ОДНОДНЕВКИ вроде сберкарты, пройдитесь по страничке. Голову желательно иметь. С собой. Что меня привлекает? Участие в поистине ГРАНДИОЗНОМ проекте, способном изменить облик планеты и который вполне может стать НАЦИОНАЛЬНОЙ ИДЕЕЙ для подъёма экономики ЛЮБОЙ СТРАНЫ.  Прикоснись к ВЕЛИКОМУ, чтобы ощутить собственную значимость! Именно поэтому я инвестирую сам и приглашаю всех в проект НЕБЕСНЫЕ ДОРОГИ.  Обращение автора технологии, Генерального конструктора: http://vk.cc/4KuMbE . Что меня НЕ привлекает? БЕСЧИСЛЕННЫЕ приглашения на пирамидальную тему в «Новыйсамыйсамыйпроекткоторыйреальноплатитвходвсего…рублейуспейбытьпервым!!!»  В отличие от этих СУПЕРГРАНДИОЗНЫХ пустышек моё приглашение БЕССРОЧНО, от скорости принятия решения зависит только СТЕПЕНЬ ВЫГОДЫ, которую вы можете иметь. Проект ВЕНЧУРНЫЙ, кто не в курсе с чем такое едят – ГУГЛ в помощь. Однако, здесь, КАК НИГДЕ И НИКОГДА, справедливо правило: «Кто раньше встал, того и … (тапки, шоколад, … вставьте своё)». Тех, кто считает этот проект лохотроном, баблосборником и прочее – ребята, идите своим путём! Наслушался таких по самые брови. РАЗРЕШАЮ всем вернуться к разговору через любой срок. Нас рассудит время. Я не призываю верить мне. Изучайте, убеждайтесь САМИ. Учтите, «глазами всего не увидишь, зряче одно лишь сердце». А. Сент-Экзюпери.   …и как только СЕРДЦЕ откликнется – добро пожаловать в команду! Регистрация в проекте: http://vk.cc/45QotN  Перед регистрацией ОЧЕНЬ ЖЕЛАТЕЛЬНО связаться со мной. Это даст дополнительные бонусы.	2016-02-06 16:38:35
2	Друзья! До Экофестиваля СКАЙВЭЙ осталось ДВА ДНЯ. Есть обстоятельства, не позволяющие мне лично участвовать в нашем ГРАНДИОЗНОМ событии, поэтому я решил сделать музыкальное приветствие фестивалю. Как это получилось - судить вам.	2016-04-21 09:03:04
3	СКОЛЬКО СТОИТ ЭкоТехноПарк? http://www.youtube.com/watch?v=w0HTryo6KbM	2016-04-08 11:29:45
4	Сегодня приобретают огромную важность слова. сказанные С.А Сибиряковым в феврале: http://vk.cc/51bkCx, поэтому ещё раз напоминаю: КТО НЕ УСПЕЕТ, ТОТ МОЖЕТ ОПОЗДАТЬ. Перед регистрацией http://vk.cc/51bs6T КРАЙНЕ ВАЖНО связаться со мной.	2016-04-08 11:24:01
5	Почувствуйте разницу: время ИДЁТ, а возможности УХОДЯТ. Настал момент, когда появились основания сказать:  ОБРАТНЫЙ ОТСЧЁТ  ПОШЁЛ! Уже этой весной, (максимум - летом) мы вполне вероятно увидим первые РЕАЛЬНО ВОПЛОЩЁННЫЕ адресные проекты. И тогда те, кто ЗНАЛ, но не сделал РЕШИТЕЛЬНЫХ ШАГОВ, в том числе не рассказал МНОГИМ об этой возможности, БУДУТ КУСАТЬ СЕБЯ ЗА ВСЕ МЕСТА, до которых даже не смогут дотянуться. СТРОЙ СКАЙВЭЙ, СПАСАЙ ПЛАНЕТУ! https://www.youtube.com/watch?v=5ltOZ7-y7so	2016-03-18 11:28:06
6	Внимание! Вопрос на 3 миллиона рублей!   В год? В месяц? В день? В час?   Это уже Вам решать.   А вопрос звучит следующим образом. Если бы Вам сегодня предложили вернуться в 1998 год и купить акции компании Google, которые сегодня сделали бы Вас мультимиллионером, Вы бы согласились?   А если бы Вам сегодня предложили нечто подобное, что в ближайшем будущем даст аналогичный результат, Вы бы согласились?   Если Вы ответили да, то тогда приглашаем Вас сегодня в 19:00 Мск посетить открытый вебинар по ссылке:  http://webinarconferencia.blogspot.com   Для кого этот вебинар:  - Для людей с активной жизненной позицией,  - Для тех, кто понимает, что иметь большие деньги - это неограниченные возможности и свобода выбора,  - Для тех, кому не нужно объяснять, что такое быть первым на рынке и собрать самые сливки,  - Для тех, кто хочет иметь по настоящему большой, легальный, долгосрочный бизнес, приносящий не только хорошую прибыль, но и реальную помощь людям,  - Для тех, кто хотя бы раз в жизни мечтал стать финансово свободным человеком,  - Для предпринимателей классического и сетевого бизнеса.   Если Вы умнее всех, всезнайка, лентяй, нытик, чрезмерный скептик, пессимист или тот, кто кругом видит один лохотрон, то Вам не сюда. В пятницу вечером для Вас есть более увлекательные занятия))   Что Вы узнаете на вебинаре:  - Какие ниши сегодня самые трендовые и где вращается больше всего денег,  - Как можно стать совладельцем нового медиахолдинга и получать пожизненно до 5% от его прибыли,  - Как встать у истоков перераспределения рынка объемом более одного триллиона долларов в год и откусить от этого пирога свой кусок пожирнее,  - И еще ряд вкусностей и полезностей!   Вебинар начинается в 19:00 Мск. Заходите за 10 минут до начала и занимайте место поуютнее.   До встречи!   Ссылка для входа:  http://webinarconferencia.blogspot.com	2016-03-11 18:12:00
7	"Очередной ответ ""экспертам"", которые ищут изъяны не в ПРОЕКТЕ НЕБЕСНЫХ ДОРОГ, а в том, ЧТО ОНИ СЕБЕ СЕМИ НАПРИДУМЫВАЛИ.  http://www.youtube.com/watch?v=NhkpP57fIrc"	2016-03-10 22:53:49
8	"Русские купцы издавна говаривали: ""Прибыль превыше всего. ЧЕСТЬ ВЫШЕ ПРИБЫЛИ. Именно УРОВНЕМ КАЧЕСТВА продукции и услуги руководствуются те компании, которые ДОБРОВОЛЬНО вводят у себя систему ISO 9001.  Их ряды пополнила и группа компаний SKY WAY - НЕБЕСНЫЕ ДОРОГИ. Репортаж об этом: http://www.youtube.com/watch?v=hVRrmmxsUd4"	2016-03-09 18:50:00
9	ЭТО ИЗМЕНИТ МИР СИЛЬНЕЕ, ЧЕМ ЕГО ИЗМЕНИЛ ИНТЕРНЕТ! http://yunitskiy.com/ НЕБЕСНЫЕ ДОРОГИ – проект не для тех, кто стремится сам и зовёт других «рубить бабло» в бесчисленных пирамидках. Загляните в своё сердце: хотите участвовать в ДЕЙСТВИТЕЛЬНО ВЕЛИКОМ ДЕЛЕ? ВАМ СЮДА!	2016-03-06 23:33:31
10	Презентация, которая покорила экспертный совет при министерстве транспорта РФ! http://yunitskiy.com/author/2016/2016_24.pdf Отныне технология ПРИЗНАНА НА ГОСУДАРСТВЕННОМ УРОВНЕ!	2016-02-29 13:02:43
11		2016-02-29 13:01:04
12	"И ещё раз ПРОСТО о СЛОЖНОМ, или ""откуда есть пошли НЕБЕСНЫЕ ДОРОГИ.""  ОСТОРОЖНО! Только для тех, кто ИЗУЧАЛ (а не ПРОХОДИЛ) физику хотя бы в школе...  http://vk.cc/4QrJMq"	2016-02-28 12:02:08
13	ИСТИННОЕ БОГАТСТВО: http://vk.cc/4Qqnt5	2016-02-28 10:25:28
14	"""МЫ С ТОБОЙ ОДНОЙ КРОВИ - ТЫ И Я"" Сейчас это многим в диковину, А ДЛЯ НАШИХ ПРЕДКОВ-СЛАВЯН ЭТО БЫЛА ОБЫЧНАЯ ЖИЗНЬ!!! http://vk.cc/4PJ7LC"	2016-02-25 17:57:44
15	Объяснения излишни - посмотрите ВНИМАТЕЛЬНО, хотя бы с 1:19 по 1:37, далее ВАМ решать, ЧТО вы можете упустить сегодня в этой жизни:  http://www.youtube.com/watch?v=RpsMt4UAmEA	2016-02-25 17:46:50
16	СЕГОДНЯ КАК НИКОГДА В ПОЛНЫЙ РОСТ стоит вопрос о том, В КАКОЕ будущее нас хотят загнать так называемые партнёры, и СОГЛАСНЫ ли вы с ним. ВЫ ЭТОГО ХОТИТЕ??? http://vk.cc/4NMW7U  ТОГДА ПРОДОЛЖАЙТЕ ПОМОГАТЬ ПИРАМИДОНАМ РАЗНОГО СОРТА ОБМАНЫВАТЬ ЛЮДЕЙ.	2016-02-25 17:42:50
17	Тем, кому небезразлично, КАК БУДУТ ЖИТЬ ВАШИ ДЕТИ, стОит задуматься: в какой части этой схемы вы окажетесь, если будете пассивными наблюдателями.  Нужно иметь гражданское мужество, чтобы заявить о своей позиции.  Из фильма «Штрафбат», приказ – утром идти в атаку через НЕРАЗМИНИРОВАННОЕ поле: http://vk.cc/4NNk9U	2016-02-25 16:51:05
18	Без прошлого НЕТ будущего. Давайте ВСЕМ МИРОМ постараемся возРОДить наши корни! http://vk.cc/4BhBak http://vk.cc/4BhBJK	2016-02-25 11:07:14
19	"Цитаты из ролика: ""Признание технологии СКАЙВЭЙ инновационной... даёт возможность участия В ГОСУДАРСТВЕННЫХ ТЕНДЕРАХ по применению технологии в ряде проектов РФ"" - см. 23-24 минуту:  http://www.youtube.com/watch?v=ThL6lURaZFk"	2016-02-24 16:50:31
20	ЭТАПЫ БОЛЬШОГО ПУТИ: УСПЕЙ НА ЭТОТ ПОЕЗД!	2016-02-24 12:57:02
21	РОССИЯ ПРИЗНАЛА СКАЙВЭЙ: подробности из первых уст. http://www.youtube.com/watch?v=ThL6lURaZFk ЧТО ВАМ МЕШАЕТ ЭТО СДЕЛАТЬ? Регистрация в проекте: http://vk.cc/45QotN Перед регистрацией ОЧЕНЬ ЖЕЛАТЕЛЬНО связаться со мной. Это даст дополнительные бонусы.	2016-02-24 11:41:56
22	НОВОСТЬ, ДОСТОЙНАЯ ВНИМАНИЯ! В связи с огромной вероятностью появления СТРАТЕГИЧЕСКОГО ИНВЕСТОРА, т.е. юр или физлица, которое выкупит ЗНАЧИТЕЛЬНОЕ количество акций (при этом венчурный дисконт РЕЗКО  упадёт!) у партнёров и приглашённых   есть возможность по 29 февраля  воспользоваться предложением приобрести УВЕЛИЧЕННЫЕ на 25% пакеты акций: http://vk.cc/4P32jZ	2016-02-23 10:47:30
23	"Пришло время изменить существующий НАВЯЗАННЫЙ порядок. Пришло время сказать всем вместе: ""КТО, если не мы? КОГДА, если не сегодня?"". Вспомним исконную традицию предков - важные вопросы решать ВСЕМ МИРОМ. Небесные дороги - спасение планеты. РУССКИЙ ПРОРЫВ - ВРЕМЯ ПРИШЛО!  http://www.youtube.com/watch?v=wci6RRsowg8"	2016-02-21 00:13:32
24	ПОВСЕДНЕВНЫЙ ТРУД, ведущий к совместному успеху. http://www.youtube.com/watch?v=tuSCAULDPIk ВПЕРЁД, К НОВЫМ ТЕХНОЛОГИЯМ НА БАЗЕ НЕОГРАНИЧЕННЫХ ВОЗОБНОВЛЯЕМЫХ ЕСТЕСТВЕННЫХ РЕСУРСОВ!!!	2016-02-21 00:11:35
25	СВЕДЕНИЯ ИЗ ПЕРВЫХ РУК: Выступление Сибирякова С.А https://www.youtube.com/watch?v=WEtHF0xzpco Выступление Юницкого А.Э https://www.youtube.com/watch?v=6cmKwpBSFMY  ЭТО ДОСТОЙНОЕ БУДУЩЕЕ! Прояви гражданскую позицию! Помоги СЕБЕ, СЕМЬЕ, СТРАНЕ, ЗЕМЛЕ! Регистрация в проекте: http://vk.cc/45QotN Перед регистрацией ОЧЕНЬ ЖЕЛАТЕЛЬНО связаться со мной. Это даст дополнительные бонусы.	2016-02-18 17:14:26
26	Джек Ма, основатель Alibaba.  сказал: “Бедных людей удовлетворить труднее всего. Дайте им что-то бесплатно – они  решат, что это ловушка. Скажите им, что это лишь небольшая инвестиция, скажут - много не заработать. Скажите им вложиться по крупному, скажут что у них нет денег. Скажите им попробовать новые темы, скажут - нет опыта. Скажите им, что это традиционный бизнес, скажут что это тяжело. Скажите им, что это новая бизнес-модель, они скажут - пирамида. Скажите им, открыть магазин, скажут - нет свободы. Скажите им начать новый бизнес – скажут  что нет доказательств что новый бизнес пойдет.  Они имеют нечто общее: любят запрашивать Google, слушаться друзей, таких же безнадежных, как и они сами, они пребывают в раздумьях больше, чем профессор университета и делают меньше, чем слепой. Просто спросите их, что они могут? Они не ответят вам. Мой вывод: вместо того, чтобы ваше сердце билось быстрее, почему бы просто не действовать немного быстрее; вместо того, чтобы просто пребывать в раздумьях, почему бы не сделать то, о чем вы думаете. Бедные люди терпят неудачи из-за одной общей черты: “Вся их жизнь проходит в ожидании “. Кто вы – решать  вам!	2016-02-15 19:18:22
27	"За Россию умирать не надо! За Россию, братья, надо жить! Защищать от чужаков проклятых! Всей душою Родину любить! Чувствовать, как гордо сердце бьётся! Знать, что все мы - славные сыны! Враг проклятый пусть да не спасётся, И его жалеть мы не должны! Будем жить и радоваться жизни! Будем о победах возвещать! Говорить: ""Благо дарю!"" Отчизне! И душой, и сердцем расцветать!"	2016-02-14 15:56:27
28	На ту же ВЕЧНУЮ ТЕМУ...	2016-02-14 14:13:44
29	Утро любого дня... Не только выходного...	2016-02-14 13:31:28
30	УЛЫБНИТЕСЬ! http://vk.cc/4MplFa	2016-02-13 15:22:24
31	ШАГ ЗА ШАГОМ... http://www.youtube.com/watch?v=nB7G9rqyhcU	2016-02-13 15:05:39
32	КОРОТКО И ЯСНО о технологии. http://vk.cc/4LOnz2	2016-02-11 11:48:44
33	Вы можете ОЧЕНЬ СЕРЬЁЗНО вознаградить себя по результатам просмотра этого видео. Кого ЭТО не убедит - продолжайте детские игры в пирамидки. http://www.youtube.com/watch?v=ikyCLfDG0F0 Регистрация в проекте: http://vk.cc/45QotN Перед регистрацией ОЧЕНЬ ЖЕЛАТЕЛЬНО связаться со мной. Это даст дополнительные бонусы.	2016-02-11 09:33:37
34	ЛИКБЕЗ ДЛЯ ИСКРЕННЕ ИНТЕРЕСУЮЩИХСЯ. Сервис ПЕРЕПОЛНЕН предложениями заработка в сети. В условиях так называемого кризиса, который используется всеми, кому не лень, для ОДУРАЧИВАНИЯ, ОКОЛПАЧИВАНИЯ и прочего обмана, тема приобрела поистине грандиозный размах. Особой популярностью пользуется давно избитый способ – ФИНАНСОВАЯ ПИРАМИДА. Какими только способами не маскируется эта многоглавая гидра – социальное партнёрство, глобальная взаимопомощь, фонд благотворительной поддержки и прочее. Научились даже «ПАТЕНТОВАТЬ» (на самом деле – ВРАТЬ об этом) особые схемы маркетинга – шахматные, кубические, переливные… и все без исключения проекты – УНИКАЛЬНЫЕ, НЕ ИМЕЮЩИЕ АНАЛОГОВ. НЕПРЕВЗОЙДЁННЫЕ… Главный аргумент – ПРОЕКТ, КОТОРЫЙ ПЛАТИТ!!! Знаете, ВСЕ платили. ВСЕ БЕЗ ИСКЛЮЧЕНИЯ. Платили, пока не насытятся организаторы либо сама система не впадёт в коллапс. И точно так же ВСЕ перестанут платить. Тоже без исключения. Раньше или позже.  Отсюда и призывы – «УСПЕЙ БЫТЬ ПЕРВЫМ!!!», «ТОРОПИСЬ, ПОКА ЕСТЬ МЕСТА!!!», «ХВАТАЙ МЕШКИ, ВОКЗАЛ ОТХОДИТ!!!», «ВСЕГО … РУБЛЕЙ!!!». Арихметика – наука неумолимо точная. Как же распознать родную? Суть проста. Задайте приглашающим (или СЕБЕ?) один-единственный вопрос: ОТКУДА берутся деньги на «заработок»? Если «100% - В СЕТЬ!!! АДМИНИСТРАЦИЯ САЙТА НЕ ИМЕЕТ ВОЗМОЖНОСТИ ОБМАНА!!!», значит присутствует главный признак ФИНАНСОВОЙ ПИРАМИДЫ (не трогайте общественные, египетские и прочие – они здесь ни при чём!!!): ВОЗНАГРАЖДЕНИЕ ПРЕДЫДУЩИХ  ЗА СЧЁТ  ВЗНОСОВ  ПОСЛЕДУЮЩИХ. Всё. Другого не бывает.  Дальше всё зависит от отношения конкретного человека. Каждый решает сам. ИМХО – участие в таких схемах безнравственно. Расшифровывать не буду.	2016-02-08 17:09:22
35	Огромная БЛАГОДАРНОСТЬ всем, кто желает видеть меня в друзьях. Месяц назад у меня было около 300 друзей и 10 подписчиков., сейчас количество заявок на добавление растёт геометрически.   Я отношу это в том числе и к тому, что тема, затронутая на стене, ДЕЙСТВИТЕЛЬНО ВАЖНА для людей. Поэтому прошу простить меня, если кого-то за отсутствием достаточного времени я буду ВЫНУЖДЕН оставить в подписчиках. МЫ ВСЁ РАВНО ВМЕСТЕ!!!	2016-02-08 14:47:03
36	"ЛИКБЕЗ ДЛЯ ИНТЕРЕСУЮЩИХСЯ. Кто слышал, мы вступили в ЭРУ ПРОСУМЕНТА. Это слово - составное из двух: ПРОДУЦЕНТ (изготовитель) и консумент (потребитель). Бизнес, в котором покупка ОБОЮДОВЫГОДНАЯ: прооизводителю деньги нужны ЗДЕСЬ И СЕЙЧАС, как правило для реализации инновации, покупатели же приобретают НЕКУЮ ЦЕННОСТЬ, стоимость которой РАСТЁТ СО ВРЕМЕНЕМ. Это шаг вперёд и вверх в сравнении с СЕТЕВЫМ бизнесом, т.к. остался механизм РЕФЕРАЛЬНОГО ПРИВЛЕЧЕНИЯ.  ВЕНЧУРНАЯ ПРЕМИЯ - оплата за риск при вхождении в проект на ранних стадиях. Чем ближе к завершению, тем меньше риски - соответственно ниже и премия.  Кратность роста вложений на определённом этапе называется ТЕКУЩИМ ВЕНЧУРНЫМ ДИСКОНТОМ.  Что касается НЕБЕСНЫХ ДОРОГ, то в самой первой стадии (январь-апрель 2014 г.) он достигал 1500, и это время ушло безвозвратно. Итак, инвестируя сегодня в ВЕНЧУРНЫЙ ПРОЕКТ ""НЕБЕСНЫЕ ДОРОГИ"", мы получим через год-полтора рост активов в 100-300 раз. Ориентировочно, дисконт каждый месяц будет падать ВДВОЕ, и к моменту завершения строительства ЭкоТехноПарка будет равен 1, то есть проект превратится из ВЕНЧУРНОГО в обычный инвестиционный.  Вот тогда и наступит время тех, кому нужны ГАРАНТИИ. только выгоды такой уже не будет."	2016-02-07 14:50:23
37	14 июня 1992 г., Рио-де-Жанейро  http://vk.cc/4KD36X Конференция ООН, на которой была принята Декларация по окружающей среде и развитию  НЕБЕСНЫЕ ДОРОГИ РЕШАЮТ ЭТОТ ВОПРОС!	2016-02-07 01:41:38
38	ПОМНИМ СВОИ КОРНИ! СЛАВят РОДину ДОБРЫ МОЛОДЦЫ http://vk.cc/4KyOcr да КРАСНЫ ДЕВИЦЫ http://vk.cc/4Kyxrp	2016-02-06 20:03:22
39	Приступаем к РЕАЛЬНЫМ ДЕЛАМ: http://vk.cc/4Ku8qK Следите за новостями. Можно здесь. Регистрация в проекте: http://vk.cc/45QotN Перед регистрацией ОЧЕНЬ ЖЕЛАТЕЛЬНО связаться со мной. Это даст дополнительные бонусы.	2016-02-06 15:36:13
40	Пылинка и БЕСКОНЕЧНОСТЬ... Капля и ОКЕАН... Мгновение и ВЕЧНОСТЬ...	2016-02-05 20:35:42
41	ГОРОДА БУДУЩЕГО. Прими участие в их воплощении! http://www.youtube.com/watch?v=FUar5jCgP8c	2016-02-03 22:10:35
